Name,Description
Unterschale,"Unterschale in German butchery refers to a particular cut of beef located in the inner part of the hind leg or the inner thigh of the cow. It is a muscle that receives a moderate amount of exercise, resulting in a cut that is relatively lean but still flavorful. Unterschale is characterized by its lean composition with a smooth texture. As it comes from a portion of the animal that does move, but not excessively, it carries a good balance between tenderness and flavor. This cut is versatile, much like the oberschale. In German cuisine, the unterschale is often roasted, but it can also be used in pot roasts, stews, or even be sliced thinly for certain beef-based dishes. It's essential to use methods that help retain its moisture, given its lean nature. If roasting the unterschale, techniques like basting or marinating can help ensure the meat remains juicy. When used in braises or stews, the slow-cooking process allows the meat to tenderize while soaking up the flavors of the accompanying ingredients. For dishes requiring thin slices, it's recommended to cut against the grain to enhance tenderness. The natural beefiness of the unterschale pairs excellently with a broad spectrum of flavors. Robust herbs like thyme, rosemary, and bay leaves complement its taste. For stews or braised dishes, ingredients like red wine, beef stock, or aromatic vegetables (carrots, onions, celery) can elevate the meat's inherent flavors. "
Hals,"   In German butchery, hals denotes the neck portion of the beef. This cut, taken from the upper section of the cow close to the head, is characteristically more muscular and robust. Due to its high content of connective tissue and muscle fibers, it demands specific cooking techniques to render it tender and palatable. While it's not the premium choice for quick-cooking methods, hals is valued in dishes that require prolonged simmering or braising. When cooked slowly, the fibers and tissues break down, resulting in flavorful and tender meat, making it an ideal choice for hearty stews, soups, and slow-cooked dishes.    "
Eierschecke,"This specialty dessert from Saxony is a sheet cake consisting of three individual layers. Yeast dough is commonly used for the base layer, but a thin sponge cake or a pie crust can be used instead. The middle layer consists of a type of custard which contains quark in addition to butter, milk, eggs, and sugar. The top layer consists of another type of custard which is mixed with vanilla pudding. After these three layers have been assembled, the cake is baked and then cut into rectangular pieces. Eierschecke is traditionally served with a hot cup of coffee and is therefore easily found in most German coffeehouses."
Kalter Hund,"Kalter Hund is a no-bake chocolate biscuit cake that is widely known in Germany and also popular in other parts of Central Europe. The name translates to “cold dog” in German, though it has no connection to animals and instead refers to the cold-set method of preparation and the shape of the loaf tin, which in old mining slang was called a “Hund” or ""dog."" This dessert is made by layering plain butter biscuits (often Leibniz or similar rectangular types) with a rich chocolate glaze or ganache made from cocoa powder, butter, and sometimes coconut oil or cream. Once assembled, the cake is chilled until firm and sliced to reveal a striped pattern of alternating biscuit and chocolate layers. Kalter Hund became especially popular in Germany in the mid-20th century, when simple, accessible ingredients and no-bake methods were in high demand. Its preparation does not require an oven, making it ideal for home kitchens with limited equipment or for occasions when ease and speed are a priority. The texture is dense and slightly crunchy from the biscuits, with a smooth and sweet chocolate component that holds everything together. The dessert is served cold and cut into rectangular slices, often appearing at children’s birthday parties, family gatherings, or holiday celebrations. Over time, variations have emerged, such as adding rum, coffee, or vanilla to the chocolate mixture, or replacing the biscuits with sponge fingers or other cookies. "
Brotsuppe,"Brotsuppe, meaning bread soup, is a humble German dish based on stale bread and meat broth (usually beef) or vegetable broth. Pieces of leftover bread (usually rye bread) are fried in butter or lard alongside onions until nicely colored and crispy before they are added to a hot broth seasoned with salt and pepper and enhanced with aromatic spices such as marjoram, caraway, or nutmeg. Some variations of the soup call for the addition of meat, egg yolks, or cream for extra flavor, and a more filling meal. Brotsuppe is also often referred to as fränkische brotsuppe as it is mainly associated with the region of Franconia, although different versions of the soup have been traditionally consumed in other parts of the country as well. Vegetarian bread soups have been a common dish prepared during Lent, especially in the rural areas. This simple soup is typically served piping hot, and it is often finished with freshly chopped chives, parsley, or lovage on top."
Flaedle,"Flädle is a German pancake consisting of basic ingredients such as flour, eggs, milk or water, sugar, and salt. The thin batter is poured into a lightly greased pan and cooked on both sides, yielding thin and round pancakes which can be both savory and sweet. The former version usually calls for the addition of finely chopped herbs such as parsley, chives, and chervil, while the batter is seasoned with salt, pepper, and sometimes ground nutmeg. Thin strips of these savory pancakes are added to a rich beef or vegetable broth to make the classic Swabian soup called flädlesuppe. Sweet flädle pancakes, on the other hand, are sweetened with sugar and (optionally) vanilla, and they are usually served for breakfast or consumed as a dessert, topped with powdered sugar or paired with jams, marmalades, fruit, or cream."
Halve Hahn,"Halve hahn is a Rhenish sandwich consisting of a split rye roll (röggelchen) that is typically buttered and topped with a thick slice of medium-ripe gouda cheese, pickles, and raw onions. Mustard is commonly added as well. It is popular throughout the Rhineland, especially in the cities of Cologne and Duesseldorf, where it can be found at most restaurants, pubs, and beer gardens. The origins of this dish are debated, but halve hahn most likely originated from Cologne in the 1870s. It is eaten as a snack between gulps of kölsch beer."
Quarkkeulchen,"Originating in Saxony, quarkkeulchen is made by combining quark, mashed potatoes, eggs, flour, and milk or water, and then shaping the mixture into flat cakes which are fried in hot oil or butter until nicely browned on both sides. This sweet specialty is usually flavored with lemon juice or lemon zest, and it is often enhanced with raisins or currants for extra flavor and texture. Qarkkeulchen can be enjoyed warm or chilled, and it is usually topped with powdered sugar and cinnamon. Applesauce or stewed fruit such as plums and a cup of fresh coffee typically accompany this simple German dessert."
Schnitzel Holstein,"This German dish is a variation of the well-known Wiener schnitzel that originated sometime in the late 19th century. Though it appears in slightly different regional variations, Holstein schnitzel predominantly consists of a breaded and lightly fried veal cutlet that comes served with various additions. A fried egg is always served on top of the schnitzel, while other additions traditionally include smoked salmon, caviar, sardines, capers, or anchovies. The dish is said to have been created at a Berlin restaurant Borchardt’s, and many believe it was named after a German statesman Friedrich von Holstein rather than the Holstein region. This filling main course is usually paired with fried slices of bread or croutons, fried potatoes, red cabbage, gherkins, or beetroot."
Bayerischer Wurstsalat,"Bayerischer Wurstsalat is a traditional salad originating from Bavaria. It's made with Regensburger knockwurst sausage, diced onions, olive oil, wine vinegar, salt, pepper, and paprika. The wurst is peeled and sliced thinly, then tossed with the onions, olive oil, vinegar, and seasonings. Before serving, it's chilled, then dusted with paprika on top. The salad is sometimes also served as an appetizer, and it's recommended to serve it with beets, pickles, bread rolls, and butter."
Westfaelischer Pumpernickel,"First described in 1450 as the black bread of Westphalia, the famous Westfälischer Pumpernickel is a traditional all-rye bread made with either coarsely ground rye meal or a combination of rye flour and whole rye kernels. It can also be flavored with malt or sugar beet syrup. The loaves are placed in lidded pans and baked slowly at a low temperature in steam-filled ovens for anywhere from 16 to 24 hours, which gives pumpernickel its characteristic deep brown, almost black color. Pumpernickel has little or no crust, a pronounced earthy aroma, and a distinctive bittersweet flavor. It is quite dense and moist, and it has an extremely long shelf-life – when shrink-wrapped, it stays fresh for months, while canned pumpernickel can be stored for as long as two years. Even though the unique flavor and texture of pumpernickel goes well with both sweet and savory spreads, the Westphalians typically enjoy it with a thick smear of butter and a topping of ham or liver sausage."
Berliner Knueppel,"Berliner knüppel is a traditional bread roll originating from Berlin. The bread rolls are usually made with a combination of water, flour, milk, yeast, and salt. The ingredients are mixed, the dough is kneaded, and it's then left to rest for a while. The balls of dough are pressed into disks that are folded into a halfcircle, and the dough is then rolled into a short and oblong log. The rolls are baked seam-side up in an oven with steam until golden brown. If properly baked, the crumb should be soft and fluffy, and the crust should be slightly crusty. Berliner knüppel rolls are traditionally served with ground meat patties known as buletten."
Linsen mit Spaetzle,"One of the staples of traditional Swabian cuisine, linsen mit spätzle combines a thick and creamy stew of brown lentils (linsen) with soft egg noodles (spätzle). Lentils are braised with bacon and vegetables and then simmered until soft and fully cooked in meat or vegetable broth, which is usually thickened with roux. The broth is typically enhanced with tomato paste and seasoned with vinegar, salt, pepper, and nutmeg. Warm and filling, the lentil stew is then transferred to a plate of boiled spätzle noodles, and it is usually enjoyed with a side of saitenwurst sausages (German string sausages) and a cold beer. This hearty combination makes a frequent appearance in restaurants and university cafeterias in the region, but it is also a beloved home-cooked dish in numerous Swabian households."
Pfefferpotthast,"Pfefferpotthast is a traditional meat stew hailing from Westphalia. It consists of pieces of beef that are simmered in a seasoned broth along with onions, soup vegetables, spices, and herbs. The meat is typically first browned in a little oil or lard before it's cooked with the other ingredients, and the broth is usually thickened with crumbled bread, traditionally with the classic Westphalian pumpernickel rye bread. Spices such as cloves, juniper berries, allspice, bay leaves, salt, and pepper are typically used for seasoning the broth. Warming and flavor-packed, the dish is perfect for a chilly fall or winter lunch or dinner, and it is usually accompanied by pickled gherkins, salt potatoes (Salzkartoffeln), beetroots, and a German beer on the side. The first mention of this Westphalian specialty dates back to 1378 in Dortmund, where an annual Pfefferpotthast Festival is held each September, usually at the end of the month."
Leberknoedel,"Leberknödel is a type of liver dumpling originating from southern Germany and Austria, especially associated with the regions of Bavaria, Swabia, and parts of Austria such as Salzburg and Upper Austria. The dish consists of finely ground liver, commonly from beef or pork (sometimes even veal), combined with stale bread rolls soaked in milk, eggs, onions, fresh herbs, and spices to create a dense, flavorful mixture that can be shaped into large, round dumplings. The liver is typically minced or passed through a grinder until smooth, then carefully mixed with the other ingredients to form a cohesive mass. Once shaped, Leberknödel are gently simmered in salted water or clear broth until firm and cooked through. These dumplings are commonly served in two main ways. They can be presented in a clear beef broth as a soup, known as Leberknödelsuppe, where the dumpling absorbs some of the broth’s flavor while adding richness to the liquid. Alternatively, they are served as a more substantial main dish accompanied by sauerkraut and boiled or mashed potatoes. The flavor is distinctly savory and robust, reflecting the use of liver and the aromatic additions of marjoram, parsley, and occasionally nutmeg or pepper. Preparation requires attention to achieve the correct texture, which should be tender but not falling apart when cooked. Leberknödel has a long history as a practical and nourishing food in rural and urban settings, where no part of the animal was wasted and organ meats were valued for their nutritional content. Today, it appears in both everyday cooking and regional restaurant menus, especially in southern Germany and Austria, where it remains an example of regional comfort food made with simple, accessible ingredients. The dumplings are typically prepared fresh, although they can also be made in advance and reheated in broth. "
Biersuppe,"As the name suggests, beer is the main ingredient of this traditional German soup that has been widely enjoyed in medieval and early modern Europe. There are numerous variations of this specialty, but it is typically made by combining light or dark beer with various other ingredients such as meat broth, water, flour, egg yolks, milk, cream, butter, and stale bread, and then simmering the mixture until it develops a thick and creamy consistency. The soup is usually seasoned with salt and pepper, but sugar, honey, or aromatic spices such as cinnamon and caraway seeds can also be added for extra flavor. Some versions call for the addition of vegetables or cheese for a more filling meal. Interestingly, in the past, beer soup used to be a typical breakfast for the nobility, but it was also commonly prepared in numerous rural households."
Hochrippe,"   In German butchery, hochrippe refers to what is commonly known in English as the upper chuck, standing rib roast, or the upper rib section of the beef. Situated in the forequarter, right next to the neck and above the querrippe, hochrippe is a meaty section with a good amount of intramuscular fat, giving it rich flavor and marbling. The presence of bone and connective tissue also imparts additional taste to the meat when cooked. Because of its composition, the hochrippe is well-suited for various cooking methods. It can be used for roasting, braising, or slow-cooking to break down the connective tissues, resulting in tender and succulent meat.    "
Duennung,"Dünnung in German butchery refers to a set of cuts from the lower belly and flank area of the cow. These are parts of the animal that are regularly exercised and, as a result, contain well-developed muscles with a substantial amount of connective tissue. Due to its location on the cow and the constant movement in this area, dünnung has a pronounced muscle structure, making it somewhat tough in texture. However, this exercise also imparts a deep, beefy flavor to the meat, making it highly desirable for certain preparations. Dünnung is best suited for cooking methods that allow for a long and slow breakdown of the meat's tough fibers and connective tissues. It's ideal for dishes that require braising, stewing, or slow-roasting. In German cuisine, parts of dünnung might be used in traditional stews or even for making certain types of sausages. Due to its inherent toughness, dünnung benefits from a prolonged cooking time at a low temperature. This allows the collagen and connective tissues to melt into the dish, rendering the meat tender and adding richness to the cooking liquid. A preliminary step of browning the meat can enhance the depth of flavor in the final dish. Given its rich beef flavor, dünnung pairs well with hearty and robust ingredients. Root vegetables, grains, and beans can complement the meat in stews or casseroles. Additionally, aromatic herbs and spices, as well as flavorful liquids like beer, wine, or beef stock, can be used to elevate its taste further. "
Schulter,"In German butchery, schulter refers to the shoulder of the cow. Positioned at the front of the animal, it is composed of multiple muscles and a significant amount of connective tissue due to the regular movement of the cow's front legs. Because of the continuous motion in this part of the animal, schulter tends to be tougher than some other cuts. This regular activity, however, endows the meat with a rich, beefy flavor and a good marbling of fat throughout the muscles. The inherent toughness of schulter means it's best suited for slow-cooking methods. When braised, stewed, or slow-roasted, the connective tissue breaks down, rendering the meat tender and flavorful. In German cuisine, schulter might be used in dishes like goulash or other slow-cooked stews. To fully enjoy the schulter, it should be slow-cooked to allow the collagen-rich connective tissues to break down. Braising with aromatic vegetables, herbs, and a flavorful liquid (like broth, wine, or beer) yields especially delightful results. Before this slow cooking, searing the meat can add an extra layer of flavor due to the Maillard reaction. The hearty beef flavor of schulter is enhanced when paired with robust ingredients. Root vegetables, grains, and legumes are natural companions. Additionally, seasonings like garlic, onion, rosemary, thyme, and bay leaves work well. Schulter also benefits from rich sauces, often derived from the very liquids it's cooked in. "
Nuss,"Nuss in German butchery refers to a specific cut of beef situated in the hind leg of the cow, more precisely in the inner part of the thigh. Its name, which translates to ""nut"" in English, hints at its rounded shape. Located deep within the leg muscles, nuss is relatively shielded from rigorous activity, rendering the meat tender compared to some other cuts from the leg. Nuss is recognized for its tender, fine-grained texture, a result of its location on the cow where the muscle experiences less strain. It has a moderate beef flavor, not as intense as some of the more exercised cuts, but still distinct and pleasing. Given its tenderness, nuss is versatile in the kitchen. It can be roasted whole, cut into steaks, or even used for beef Stroganoff or goulash in German cuisine. It's a popular choice for dishes that benefit from tender beef without the need for prolonged cooking. When roasting, it's a good practice to baste nuss to preserve its juiciness. If opting to turn it into steaks or strips, quick cooking methods like grilling or pan-searing work well. It's also a favorable choice for dishes that require beef to be cut into cubes, as its tenderness ensures a pleasant mouthfeel in the final dish. The milder flavor of nuss works harmoniously with a variety of ingredients. Classic herbs like rosemary, thyme, and parsley can enhance its natural taste. When used in stews or sautés, it pairs well with creamy sauces, mushrooms, onions, and even mustards or wines to deepen the dish's complexity. "
Flanke,"In German butchery, flanke refers to a specific cut of beef taken from the abdominal muscles of the cow. Situated below the loin and rib and spanning the belly area, flanke is a long, flat cut. It plays a crucial role in the cow's locomotion and thus has a well-developed muscle structure. Due to its location on the cow and the constant activity of this muscle, flanke tends to be lean and possesses a distinct grain pattern. While it's flavorful due to its well-exercised nature, it's also inherently tough, with pronounced muscle fibers. Flanke's grainy texture lends itself well to specific culinary applications. In German cuisine, it's not as prominently featured as in some other cultures, like in Latin American cuisines where it's the chosen cut for dishes like carne asada. Nonetheless, it's still valued for dishes requiring longer cooking times, like braising, or when meat is thinly sliced against the grain. Marinating the flanke can introduce additional flavors and help tenderize the meat, especially if acidic components are used. Grilling or broiling after marination is common. If cooking whole, it's essential to slice it against the grain to maximize tenderness. Slow-cooking methods, like braising, can also break down its tougher fibers, rendering the meat more tender and succulent. The beefy flavor of the flanke pairs excellently with bold marinades and spices. Ingredients like garlic, chili, citrus, and vinegar can enhance its natural taste. In stews or braised dishes, aromatic vegetables, robust herbs, and flavorful liquids (like beer, wine, or beef broth) further complement flanke's characteristics. "
Boetel,"Bötel is a traditional salt-cured ham hock or pork knuckle hailing from Magdeburg. Just like its cousin from northern Germany, the well-known eisbein (cured and boiled pork knuckle), this cured pork knuckle is typically simmered before it is traditionally served with a side of puréed peas and sauerkraut. The combination is locally known as bötel mit Lehm und Stroh, translating to pork knuckle with clay and straw, where clay refers to the side of puréed peas, while straw refers to the sauerkraut. The term bötel actually means house, estate or farm in Low German, and, therefore, the name of the dish mentioned above would also translate to a house with clay and straw. Other typical accompaniments to the salt-cured and boiled pork knuckle include mashed potatoes, slices of fresh bread, and a cold beer on the side."
Hesse,"In the American, German, and Brazilian systems of primal beef cuts, the shank (hesse, músculo) is the term used for the leg portion of the cow. There are both front and hind shanks, coming from the legs of the steer. The shank is known to be one of the toughest cuts due to the fact that it comes from a part of the animal that is heavily exercised. As such, it contains a high amount of connective tissue, which can be made tender and flavorful through slow, moist-heat cooking methods like braising. The meat from the shank is often used in dishes like soups and stews. Shank is also commonly used for making bone broths and stocks, as the bones from the shank contain marrow, which adds depth and richness to the liquid. "
Huefte,"Hüfte in German butchery refers to a specific cut of beef located around the hip area of the cow. Being situated on the back part of the cow, hüfte comes from a muscle region that is somewhat active but not overly so, which results in meat that is tender yet flavorful. Hüfte is characterized by its moderately tender texture, a middle ground between the highly tender cuts like the fillet and tougher cuts like the shank. It carries a pronounced beefy flavor, a result of its location on the cow, where the muscle gets a good amount of exercise but not to the point of becoming tough. This cut is versatile in German cuisine. It can be roasted as a whole joint or sliced into steaks. Given its balance of tenderness and flavor, hüfte is often chosen for dishes that benefit from a beefy taste but still require a tender bite, such as certain stews, stir-fries, or even carpaccio. When roasting the hüfte, it can be beneficial to sear it first to lock in juices and then finish the cooking process in the oven. If opting for steaks, quick, high-heat methods like grilling or pan-searing are ideal. Marinating can enhance the flavor and add a layer of complexity to the dish. The rich flavor profile of hüfte pairs well with a broad range of ingredients. Robust herbs such as rosemary, thyme, and garlic can accentuate its beefiness. For a more contemporary twist, ingredients like soy sauce, ginger, or even certain fruit-based marinades can offer a delightful contrast. "
Schlachteplatte,"Schlachteplatte is a traditional Bavarian feast that consists of different types of meat and sausages. It typically contains smoked pork chops, slab bacon, bratwurst, blood sausages, liver sausages, bauernwurst, knackwurst, and wienerwurst. Grilled or cooked, the meat varieties are placed on a large serving platter, usually topped with freshly chopped parsley. A typical winter specialty, the dish is traditionally accompanied by cooked sauerkraut, potatoes, gravy, potato dumplings, or bread dumplings. The dish’s name translates as butcher’s plate from the German words Schlachten and Platte, which mean to butcher and platter, respectively. This German meat specialty most certainly got its name after the tradition of preparing it during the slaughter period in Germany."
Mutzbraten,"Mutzbraten is a spit-roasted pork specialty originating from the Thuringia region. It consists of pork meat that is cut into pieces and then soaked in a marinade of water, salt, pepper, marjoram, thyme, and onions. Traditionally roasted over a birch wood fire, this meat dish is typically accompanied by sauerkraut and fresh bread on the side."
