Name,Description
Brezel,"Considered an iconic symbol of Germany, the pretzel is a type of traditional baked good that is made by combining flour, salt, malt, yeast, and water. The resulting dough is then shaped into a well-known knotted shape of a pretzel before it is baked. Pretzels are often dipped in a lye solution (natronlauge in German) before they are baked, and then they are called laugenbrezel, a Bavarian-style pretzel distinguished by a nice, brown, and crispy exterior that surrounds the soft interior. Coarse salt is usually sprinkled over the surface of the pretzels, but other toppings may also be used, including sesame, pumpkin, sunflower, or poppy seeds. Regional variations of the pretzel abound, with some of them using fat to obtain a softer dough and others calling for different types of flour such as whole wheat flour or spelt flour. German pretzels come in both sweet and savory versions, and their texture may range from soft to hard. They are usually enjoyed warm as a snack with butter or along with German wurst sausages and a cold German beer on the side for an authentic German experience. The pretzel is a favorite street snack and a staple at any festival, holiday, and Christmas market in the country. Its versatile nature has given rise to numerous variations including New Year’s pretzels (neujahrbrezel), Oktoberfest pretzels (also called wiesnbrezn), and Lent pretzels (fastenbrezeln), among many others. In Alsace, France, the pretzel is known as bretzel d'Alsace."
Bratwurst,"What was once an item for survival during the cold winter months and a technique of not wasting meat scraps is nowadays a delicacy consumed throughout Germany and abroad. Bratwurst stems from two words, an Old High German word brat, meaning meat without waste, and wurst, which means sausage. Bratwurst has origins with the Celtics, but the Franconians developed it further. It dates back to the 1300s in a region that would eventually become Eastern Germany. Bratwurst is usually consumed for breakfast, due to the tradition of farmers who would make the sausages in the morning and eat them by noon, as they would otherwise spoil. Technically, a bratwurst must be made from either pork, veal, or beef, but there are more than 40 varieties of the sausage throughout Germany. The oldest recipe for bratwurst was discovered in 2000 by a historian named Heinrich Höllerlhas. The same recipe, for the Thuringian bratwurst (one of the most famous varieties), says that the makers had to use only the purest, unspoiled meat in the production process. Today, bratwursts are commonly served with sauerkraut, potato salad, horseradish, or mustard in Germany, but the sausages are also popular in the United States, especially in Wisconsin, where they are commonly found at summer cookouts and barbecues."
Schwarzwaelder Kirschtorte,"Black Forest cherry cake is a popular German dessert consisting of chocolate sponges that are coated in whipped cream and dotted with kirschwasser-infused cherries. Some varieties use the kirschwasser brandy to soak the chocolate layers or to lightly flavor the whipped cream. When assembled, the cake is lavishly decorated with whipped cream, chocolate shavings, and cherries. Among the numerous theories about its invention, it is still debated whether the cake was created by confectioner Josef Keller or pastry chef Erwin Hildenbrand. What is certain is that Schwarzwälder Kirschtorte originated in the Black Forest area and was in all likelihood modeled on the colors of the regional folk dresses. Since its first appearance in written form in 1934, it has become a well-known German dessert that is enjoyed throughout the country.  "
Lebkuchen,"This traditional German treat is mainly associated with Christmas and winter holidays. The term lebkuchen covers a wide variety of different types of honey or ginger-flavored cookies which are traditionally baked on oblaten (thin wafers), and glazed or coated with either dark chocolate or sugar icing. Additional ingredients may include various spices like cloves, aniseed, nutmeg, coriander, and cardamom, with different types of nuts or candied fruit. Best-known varieties of this cookie include the heart-shaped lebkuchenherzen which are often decorated with icing and different inscriptions, the German version of the gingerbread man called honigkuchenpferd (lit. honey cake horse), and hexenhausel (lit. witch’s house), while the most famous is the Nurnberger Elisenlebkuchen. In Germany, the earliest records date back to the year 1296 and the city of Ulm, and the year 1395 and the city of Nurnberg. The area itself was an intersection of many trade routes that supplied it with spices necessary and thus helped to keep the production of lebkuchen alive and thriving. In 1996, the Nurnberger lebkuchen was granted the protected designation of origin (PDO) status which applies to all the lebkuchen produced in the city of Nurnberg."
Stollen,"Stollen is one of German Christmas classics. This rich fruit bread is prepared with a buttery and sweet yeast dough that is usually spiced, lemon-flavored, and enriched with various dried fruits and marzipan. Though it may appear in different forms, it is usually oblong and covered with generous amounts of melted butter and powdered sugar. Among the different varieties, Dresdner stollen is considered as the oldest and the most popular version, whose origins date back to the 15th century. Originally, stollen was plain and prepared only with flour, yeast, and oil, and it was only in 1490, when the Pope Innocent VIII lifted the ban on baking with butter during Advent, that the stollen started to develop into a dense and rich cake that is known today."
Sauerbraten,"The traditional German pot roast is one of the best ways to transform more tougher cuts of beef into a tender, succulent meal. Chuck and bottom round are most favored cuts for this German classic, while the key to a perfect sauerbraten is in its lengthy marinade of red wine, tart vinegar, and spices, which tenderizes the meat infusing it with sharp, tangy flavors. After long hours of braising, the remaining cooking liquid is whisked into einbrenne (roux), and finally simmered into a thick, brown gravy. Sauerbraten is traditionally served with German favorites such as spätzle egg noodles, bread dumplings, or boiled potatoes and a side of braised or roasted red cabbage."
Leberkaese,"Leberkäse is a traditional product consisting of ground meat that is flavored with onions and baked into a meatloaf. The loaf is characterized by a crispy crust on the exterior, while the interior remains juicy and pink. The dish can be served either hot or cold, and it is recommended to pair it with mustard and bread, while some like to fry the slices of meatloaf in a pan and consume it as a quick snack."
Currywurst,"No other dish in Germany is as well known as currywurst, a street snack that has become an indispensable part of Germany’s culinary heritage. The dish is made from two essential parts - boiled and subsequently fried sausage, served whole or sliced, and a smooth and rich curry-spiced tomato sauce. With a portion of french fries or a kaiser roll on the side, the dish is usually lightly dusted with yellow curry powder. A wide range of sausages are used for currywurst, but the famous German bratwurst is the most commonly used variety. The real star of this dish is its gravy-like sauce made with puréed tomatoes and infused with the aromatic curry powder. The popularity of currywurst in Germany has generated numerous legends about its origins. Even though Hamburg is sometimes mentioned as its birthplace, Berlin is the city that is most commonly associated with the invention of this delicious dish. The most famous legend tells the story of Herta Heuwer, a Berlin local who is widely credited as the inventor of the tomato and curry concoction. In 1949, amid the aftermath of World War II, many ingredients were hard to come by and life was tough. However, thanks to Herta’s negotiating skills, she was able to get hold of a hard to come by ingredient –  British yellow curry powder. She then mixed it with puréed tomatoes and other spices to create the base sauce, which she served with the sliced sausage. The dish became an instant success. Herta patented her creation and never revealed her original recipe. Later, as currywurst grew in popularity, numerous varieties popped up all over Berlin and the rest of Germany. No two are the same, and every local has their own favorite style and a favorite currywurst place. Germans are so fond of this fast food staple that they have even built a museum in its honor. Located in Berlin, the Currywurst Museum offers a glimpse into the history of the legendary currywurst, as well as a detailed overview of the numerous varieties, cooking styles, and serving options of this famous dish."
Weisswuerste,"Weisswurst or white sausage is a famous specialty of the city of Munich, invented in 1857 by a butcher named Sepp Moser. He was working in a restaurant next to his butcher's shop and had used the last of thick sausage skins used to make regular sausages. To solve the problem, he opted for thin skins. As he made the sausage, he was worried that it would burst open during the frying process, so he put them in hot water and cooked them for 10 minutes. After serving the cooked sausages to the guests, the new dish was praised, and Weisswurst was born. The sausages consist of a mixture of pork, veal, and pork fat, seasoned with parsley, pepper, lemon, and salt. Today, the sausages are most popular in southern Germany, and they are one of the most consumed items at Oktoberfest. In restaurants, Weisswurst is always served hot, usually accompanied by pretzels and, ideally, Händlmaier's Hausmacher Senf, although it can be served with other Bavarian sweet mustard varieties if the original Händlmeier brand is unavailable. The sausage casing is not intended for consumption, so the sausages are often sliced along their length, and the casing is peeled. Interestingly, it is considered a taboo to eat Weisswurst after noon in Bavaria. This tradition stems from the past when the sausages were made fresh, and were supposed to be consumed as quickly as possible. "
Rouladen,"Rouladen are traditional German meat rolls stuffed with a variety of ingredients. They are always served accompanied by a creamy sauce. The rolls are usually made with long and thin beef steaks, which are pounded, generously seasoned, and usually covered with a layer of sharp German mustard, which flavors them and keeps the meat juicy and tender. Traditional stuffing inside rouladen usually incorporates thin strips of bacon and sliced pickles, but there are many different regional combinations which might include carrots, onion, or bread. The steaks are typically rolled into small logs and secured with toothpicks. Rouladen are shortly seared on all sides, then braised in a flavorful mixture of wine and vegetable or meat broth. The same broth, commonly thickened with flour, is usually used as the base for a velvety sauce accompanying the rolls. Potato dumplings, braised red cabbage, mashed potatoes, spätzle, different vegetables, or soft boiled potatoes can all be served as side dishes with this German classic. Even though it is believed that the name roulade derives from the French rouler, which means to roll, this delicacy is considered to be an authentic German dish."
Schweinebraten,"Schweinebraten is a traditional pork roast originating from Bavaria. It is typically prepared for Sunday lunch and consists of sliced pork roast that's served with homemade gravy, semmelknödel (bread dumplings) or potato dumplings, and either sauerkraut or rotkohl (red cabbage). When properly prepared, the meat should be succulent and very tender. The best part of pork to use for this dish is boneless pork shoulder. Before the preparation, pork is often rubbed with mustard, marjoram, or minced garlic, giving it a bit of extra flavor. For the best possible experience, it is recommended to pair the dish with a cold German beer on the side, preferably a lager."
Bayrisch Creme,"This rich, silky egg custard is thickened with gelatin and combined with whipped cream. It is traditionally served cold, and is usually garnished with pieces of fresh fruit or drizzled over with sweet sauces. Although its origins are quite unclear, it is known that Bavarian cream hails from either Germany or France. Many French chefs worked in Bavaria during the 17th and 18th century, so it is believed that they learned the recipe there. Some believe that the dish was invented by a famous French chef Marie-Antoine Carême, who wrote a recipe for it in the early 18th century. Today, Bavarian cream is consumed on its own as a decadent dessert or used as a filling for various cakes and pastries."
Leberwurst,"Leberwurst is a spicy German sausage consisting of a combination of ground pork liver, onions, and spices. The sausage is traditionally consumed with sauerkraut, although it can also be used in sandwiches, where leberwurst is sliced and paired with cheese, mustard, pickles, and bread. It might be cooked, but most leberwurst varieties are spreadable and can be consumed uncooked. Apart from Germany and Austria, this sausage is popular in many other countries such as Slovenia, Serbia, and Romania, and today there are many varieties of leberwurst, with additions such as mushrooms and cowberries."
Kaesespaetzle,"Käsespätzle is a simple noodle dish that combines spätzle noodles with a creamy mixture of melted cheese. The noodles are also called knöpfle, meaning little buttons, and are made with eggs, flour, milk or water, and seasonings such as salt, pepper and (sometimes) nutmeg, while käse refers to the melted cheese mixture, which is usually a combination of two or more types of cheese such as Edam, Gouda, Fontina, Gruyère, Appenzeller, or Emmental cheese. The noodle mixture is typically pressed through a specially designed spoon or colander directly into boiling salted water and cooked until done before it is mixed with the melted cheese. Also referred to as käsknöpfle, the dish is typically enjoyed with additional grated cheese and caramelized onions on top, and typical accompaniments include apple sauce, potato salad, and fresh green salads. Versions of this dish are traditionally consumed in Southern Germany, Swabia, Austria, and Liechtenstein, and it's also a typical dish in Switzerland, Hungary, Alsace, Moselle, and South Tyrol. "
Schweinshaxe,"The term Schweinshaxe is typically used in the southern parts of Germany, predominantly in Bavaria, and it usually refers to a whole pork knuckle that is roasted for hours until it is thoroughly cooked and the skin becomes golden brown and crispy. Pork knuckles are a staple in traditional German cuisine, and they come with various names such as hachse, haxe, haxn, knöchla, hechse, hämmchen, and bötel, mainly depending on the region and a slightly different preparation process. Eisbein is the northern version of the dish that is typically cured or pickled and then boiled. Though it is commonly found in restaurants throughout the country and the region, Schweinshaxe is a quintessential dish at the popular folk festival Oktoberfest. The knuckle is almost always served whole, and it's usually accompanied by sauerkraut, braised cabbage, roasted potatoes, or potato dumplings. Similar dishes are found in other European countries, such as pečené vepřové koleno in the Czech Republic. "
Pumpernickel,"This heavy and slightly sweet rye bread is made from a sourdough starter and coarsely ground rye with whole rye berries as its base. Its name comes from the German pumpern, a synonym for being flatulent, and the male given name Nickel—a form of the name Nicholas—which was commonly associated with the devil in New High German vernacular. Thus, pumpernickel literally translates to ""devil’s fart,"" which is a definition accepted by most publishers and dictionaries, however strange it may sound. The traditional German pumpernickel contains no coloring agents, but instead relies on the Maillard reaction to impart a deep brown color and a sweet, almost chocolatey and earthy flavor and aroma. Apart from being delicious, pumpernickel is rich in resistant starch which is known to aid digestion and benefit blood sugar regulation."
Obazda,"This Bavarian cheese spread was originally invented to make use of ripened soft cheese. It consists of a creamy combination of butter, paprika, and typically Camembert and Brie, or optionally Romadur, Limburger, and sometimes even cottage cheese. The spread is usually enriched with onions or shallots, caraway, or various herbs, while some versions may include beer, wine, or milk-based products. It is believed that obazda was popularized in the 1920s by Katharina Eisenreich, who served it at her Braustuberl pub in Freising. Nowadays, the spread is a Bavarian staple that is served in numerous restaurants and pubs, usually alongside pretzels and various snacks."
Semmelknoedel,"Semmelknödel are popular German bread dumplings–nutritious and convenient, they are one of the most versatile side dishes in traditional German cuisine. Even though there are numerous semmelknödel varieties, which come in various sizes, they all have a recognizable round form and employ bread as the base ingredient. Sliced or diced bread pieces, which can be fried in oil, are usually soaked in plain milk to soften, then mixed with eggs to form a pliable, soft base. Since they are incredibly neutral on their own, bread dumplings are usually mixed with different spices and additional ingredients to form a myriad of flavorful varieties. They commonly include onions and fresh herbs such as parsley or marjoram, but can even withstand strong flavors coming from nutmeg or fresh lemon zest. Even though semmelknödel are mostly served as a complement to various roast meat dishes and stews, they can be enjoyed as a nourishing dish on their own, usually served alongside vegetables and lentils, or doused in creamy mushroom sauces. Various dumplings are omnipresent in many European cuisines, but the invention of semmelknödel has usually been associated with the German region of Bavaria, from where it spread to other parts of Germany and countries such as Austria, Hungary, and the Czech Republic."
Jaegerschnitzel,"Jägerschnitzel is a traditional version of schnitzel that is topped with a gravy called Jägersoße, meaning hunter's sauce. Originally made with venison or wild boar, nowadays the most common types of meat used for this dish are pork or veal. In some regions of Germany, the meat cutlets are not breaded, but simply pounded until thin, then seasoned, and cooked. The delicious gravy that accompanies the schnitzel is made with mushrooms, bacon, onions, a splash of wine, and spices such as thyme, rosemary, salt, and pepper. Spätzle or various potato dishes and salads are most commonly served alongside this dish."
Kartoffelsuppe,"Kartoffelsuppe is a popular German soup made with potatoes as its key ingredient. The soup is usually cooked with the addition of onions, celery, butter, and milk. It is characterized by a very thick consistency. This soup is a specialty of the Baden region, traditionally served at harvest time, when it is often accompanied by plum cake. In other German regions, Kartoffelsuppe is often consumed with steamed dumplings. In some varieties of the soup, such as the Berlin Kartoffelsuppe, it is recommended to garnish the dish with croutons and parsley."
Kaesekuchen,"German-style cheesecake is a traditional dessert consisting of a thin layer of shortcrust pastry that is topped with a creamy combination of quark cheese, eggs, and (occasionally) various fruits. Even though käsekuchen is often compared to the classic American cheesecake, the use of lightly acidic quark cheese results in a light, scrumptious treat that perfectly combines sweet and sour flavors. Usually served dusted with powdered sugar, käsekuchen is a classic German dessert that is commonly enjoyed as an everyday treat alongside coffee or tea."
Wiesn Hendl,"Wiesn Hendl is the Bavarian roasted chicken, traditionally seasoned only with salt and sometimes parsley, then grilled and sold as half a chicken or whole chicken. During the roasting process, the chicken is often doused with melted butter. It can be found in many beer gardens and it is especially popular during Oktoberfest. When served, hendl is usually accompanied by potato salad or large pretzels called brezn."
Spaghettieis,"Spaghettieis is a traditional ice cream that’s made to look like a bowl of spaghetti with tomato sauce and grated parmesan cheese. This dessert was invented in Mannheim, Germany in 1969 by Dario Fontanella, the son of an ice cream making Italian immigrant. In order to prepare it, he pushed vanilla gelato through a spaetzle press on a dollop of whipped cream, then topped it with strawberry syrup and white chocolate shavings. A cookie or wafer is often placed on the side to mimic a piece of Italian bread. Nowadays, spaghettieis can be bought at almost every ice cream parlor, known as eisdiele, because Fontanella didn’t patent his invention. Today, there are different spaghettieis flavors such as banana, chocolate, kiwi, or melon. "
Kartoffelpuffer,"German potato pancakes are a restaurant staple, a homemade classic, and a popular street food snack. They are prepared with a thick batter that employs grated raw potatoes, flour, and eggs, and are usually shaped into flat, round discs that are shortly pan-fried until golden and crispy. Even though they are often served as a complement to stews, grilled meat, and sausages, potato pancakes make an excellent snack or main course. Kartoffelpuffers are traditionally accompanied by creamy apple sauce, fruit preserves, or sour cream."
Baumkuchen,"The German version of spit cake, known as baumkuchen, is just one of many similar cakes found throughout Europe. There are various conflicting theories about its origin—one points in the direction of a German town called Salzwedel in the 19th century, while others say it’s a descendant of the Hungarian wedding cake. The batter–typically made from flour, eggs, sugar, vanilla, salt, and butter–is thinly coated on a spit that’s rotating over a heat source. Before each new layer is applied, the previous one must be fully dry. Once sliced, the cake has a lovely texture and appearance which resembles growth rings, hence its name–baumkuchen or tree cake. The basic dough can be enriched by various ingredients such as nuts, honey, and brandy. The cake is often additionally coated with sugar or chocolate glaze. Miniature, cut up slices of this cake - called baumkuchenspitzen or tree cake tips - are usually glazed in chocolate and sold individually."
Apfelkuchen,"German apple cake is a delightful combination of dense, buttery dough and sliced, halved, or diced apples. Depending on the region, the cake is often dusted with cinnamon sugar, covered in crumbly streusel, or doused in vanilla-flavored custard. Traditionally baked in round tins, sliced apple cake is usually enjoyed as a filling afternoon dessert that is often paired with coffee or tea."
Bratkartoffeln,"Pan-fried potatoes are a classic, versatile German dish that is easily adapted with additional ingredients and comes in different flavor combinations. The potatoes are traditionally diced or sliced, buttered and salted, and can be then combined with bacon, ham, onions, vegetables, and a variety of fresh herbs and spices. The key is to achieve crispy, golden potatoes that stay soft and tender on the inside. Simple and affordable, bratkartoffeln is a common restaurant dish as well as a popular home-cooked meal that is usually served as an accompaniment to roasted or grilled meat, sausages, fish, or fried eggs."
Bockwurst,"Bockwurst is one of the most common sausage varieties enjoyed in Germany. The sausages were originally prepared with finely ground veal, but today they can employ various types of meat and numerous combinations of spices and fresh herbs. They come in different shapes and are usually pale in color. Bockwursts are typically stuffed in natural casings, which makes them perfect for simmering in hot water or grilling. According to a popular belief, they were invented in Berlin in 1889 by a pub owner named Richard Scholtz, who served them alongside bock bier. Today, they are internationally famous and especially favored in Germany and Austria, where they are usually enjoyed with a dollop of mustard, sauerkraut, or boiled potatoes on the side."
Quarkbaellchen,"Quarkbällchen, meaning quark balls, is a traditional snack that is typically made by combining quark, flour, eggs, sugar, vanilla sugar, and baking powder. Milk, melted butter, cinnamon, lemon zest, and corn or potato starch are also sometimes added to the combination. The quark mixture is shaped into small balls which are deep-fried until golden brown on the outside and soft and fluffy on the inside. Once done, the fried balls are usually coated in powdered or granulated sugar or a cinnamon-sugar mixture. Thought to hail from Bavaria, this sweet treat is generally enjoyed as an afternoon snack alongside a cup of tea or coffee. Resembling donuts, quarkbällchen are available in bakeries throughout Germany, and they’re often prepared during the festive Christmas season, New Year’s Eve, Fasching (Germany’s carnival season), and Oktoberfest."
