Name,Description
Schlesisches Himmelreich,"Schlesisches Himmelreich or Silesian heaven is a traditional dish originating from Silesia. It consists of smoked pork that is gently simmered with dried fruits such as pears, apples, and prunes. It's traditionally accompanied by kartoffelklöße potato dumplings that are simmered in the same pot until they float on top. The combination of smoky meats and tart, sweet-sour fruits was beloved in the past with the early Silesian settlers, but nowadays the dish is made just occasionally in very few households. There are a few variations on the dish – one uses stewed pie melon flavored with cinnamon, currants, and lemon rind instead of the stewed dried fruits, and another one served the pork with sweetened stewed quinces."
Aepfel im Schlafrock,"Jabuke u šlafroku is a traditional, old dish that is a typical representative of Croatian comfort food. It is prepared by dipping thinly sliced apples in a batter consisting of flour, eggs, milk, and vanilla sugar. The concoction is then fried in hot oil until the apples turn golden-brown on the exterior. After frying, the apples are often dusted with cinnamon or powdered sugar for extra flavor. The unusual name of the dish means apples in a bathrobe, referring to the fact that the apples are 'dressed' in a crispy external layer. And although it's not a traditional pairing, it's recommended to serve the dish with vanilla sauce on the side. In Germany, the same dish, but usually made with whole peeled apples is called Äpfel im Schlafrock, and the apples are sometimes filled with apricots or peaches."
Schnuesch,"Schnüsch is a traditional stew or vegetable stew originating from the northern parts of the country. It’s made with a combination of carrots, potatoes, kohlrabi, green beans, peas, stock, parsley, milk, flour, sweet cream, salt, and pepper. The stew is simmered until all the ingredients have become tender, but still slightly firm to the bite and not falling apart. Schnüsch is traditionally sprinkled with chopped parsley and served with slices of raw ham."
Rostbraetel,"Rostbrätel is a traditional dish originating from the region of Thuringia. The dish is made with a combination of pork neck, onions, mustard, salt, pepper, garlic, butter, and dark beer. The sliced pork neck is tenderized and marinated in salt, pepper, mustard, onions, and dark beer. It is then grilled over charcoal, and as it cooks, the meat is basted with the marinade. Once done, rostbrätel is topped with pan-fried onions and garlic before serving. It’s recommended to pair the dish with a glass of dark beer and serve it with bread rolls or potato salad on the side as accompaniments."
Helgolaender knieper,"Helgoländer knieper are cooked claws of the brown crab, a specialty of Helgoland, a tiny German island in the North Sea located some 70 km off the coast of Germany. This barren and rocky patch of land has been most famous for lobster fishing, but lobster has all but disappeared since World War II. In contrast, the population of brown crabs (or edible crabs) has been steadily rising, so nowadays, this crustacean is one of the island's main exports. While still on the boat, fishermen remove the claws and use the body for bait. The claws are later cooked in seawater, a traditional method of preparing kniepers (which literally means claws). Once done, the claws are either smashed with a hammer or a crab leg cracker, and a special seafood fork is used to scrape the meat out of the shell. Helgoländer knieper are usually paired with some fresh bread, butter, and various dips, like curry, garlic sauce, or dill and cognac. "
Ente in Bier,"Ente in bier is a traditional duck-based dish originating from Germany. The dish is usually made with a combination of duck, dark beer, chicken stock, garlic, butter, flour, marjoram, onions, anchovy paste, parsley, celery, lemon zest, bay leaves, thyme, and salt. The duck is cut into pieces, seasoned with salt, and dredged in flour before it's browned in butter on all sides. Dark beer is added to the pan with the chicken stock, garlic, onions, lemon zest, bay leaves, thyme, celery, and parsley. The dish is simmered until the duck becomes tender, and the vegetables, lemon zest, and bay leaves are removed from the pan. A mixture of flour and water is then added to the pan along with the anchovy paste in order to make the gravy. The duck pieces are served on a warm plate and the gravy is poured over the meat."
Siegerlaender Kruestche,"Siegerländer Krüstche is a traditional dish originating from Siegen. The dish is usually made with a combination of a pork cutlet, flour, eggs, breadcrumbs, bread, butter, salt, pepper, and oil. The pork cutlet is seasoned with salt and pepper, rolled in flour, dipped in egg wash, dredged in breadcrumbs, and then fried in hot oil until golden brown. The bread slices are toasted, spread with butter, and then topped with the fried pork cutlet, while the cutlet itself is topped with a fried egg in order to finish the dish. "
Gefuellter Gaensehals,"Gefüllter gänsehals is a traditional dish consisting of stuffed goose neck. The dish is made with a combination of goose neck, goose liver, bacon, bread rolls soaked in milk, parsley, lemon zest, goose fat, onion, chicken stock, salt, and pepper. The neck is rinsed and one end is sewn closed. The bacon is heated in a pan and fried with diced goose liver and bread roll pieces.. The mixture is sprinkled with parsley, grated zest, salt, and pepper, and it's then ground. The neck skin is filled with the mixture and sewn closed on the other end as well before it's sautéed in goose fat and minced onions. Once the neck turns golden, chicken stock is added to the pan and the dish is simmered over low heat for about an hour. Once done, the stuffed goose neck is served sliced just like a wurst. The dish is served hot or cold."
Frankfurter Pudding,"Frankfurter pudding is a traditional pudding originating from Frankfurt, and although there are many versions of hot steamed chocolate pudding throughout the country, this one is considered to be one of the best and richest. It's usually made with a combination of breadcrumbs, egg yolks, egg whites, butter, sugar, grated almonds, chocolate, and rum or strong coffee. The butter is creamed with sugar until light and fluffy. Egg yolks are blended into the mixture along with melted chocolate, rum or coffee, almonds, and breadcrumbs. The egg whites are beaten until stiff and then folded into the mixture. It's placed into a buttered mold and steamed in a water bath until the pudding is set. After a few minutes, the chocolate pudding is inverted on a serving platter. The pudding is typically served with warm vanilla sauce."
Gruene Bohnen mit Bohnenkraut,"Grüne bohnen mit bohnenkraut is a traditional dish that's usually served as an accompaniment to meat dishes. The dish is made with a combination of green beans, savory, butter, onions, flour, vegetable stock, and salt. The green beans are washed, cut, and cooked in boiling water until tender. Savory is added in the last five minutes of cooking. Once done, the green beans are drained and the stock is reserved for later. The onions are sautéed in butter, sprinkled with flour, and covered with the stock. The mixture is beaten smooth with a whisk and mixed with green beans. The dish is simmered for a few more minutes before serving."
Badische Zwiebelsuppe,"Badische Zwiebelsuppe is a traditional onion soup originating from Baden and influenced by neighboring France. It's usually made with a combination of thinly sliced onions, chicken stock, butter, flour, egg yolks, dry white wine, cream, salt, pepper, and chives. The onions are sautéed in butter, then mixed with flour and cooked over low heat. The chicken broth is heated and added to the pan. The mixture is seasoned with salt and pepper and simmered before the egg yolks, wine, and cream are mixed into the soup while it's removed from the heat. It is then reheated for a few minutes, but not boiled, and served hot. This creamy onion soup is often garnished with chopped chives before serving. "
Bruckbam,"Bruckbam is a regional Bavarian dish made of thick potato noodles that are cooked in the oven, prepared in parts of southern Germany where potato-based specialties have long been staples of rural cooking. The name is less widely known outside local communities, but the dish itself reflects the broader Bavarian preference for simple, hearty meals that combine potatoes, flour, and basic seasonings. The preparation begins by making a dense dough from cooked, riced potatoes mixed with flour, eggs, and salt. This dough is shaped into thick, short noodle-like pieces, which are arranged in a greased baking dish. Once formed, the potato noodles are either baked on their own until golden or moistened lightly with broth or milk to keep them soft. Some versions add small pieces of bacon or onions on top to infuse the dish with more flavor as it bakes. The result is a satisfying combination of a tender interior with lightly crisped edges. Bruckbam is typically served hot, often alongside braised meats, sausages, or simple salads. The dish is most common in rural households, where it has been valued as a way to make use of leftover potatoes and stretch them into a filling main or side course. In some Bavarian villages, Bruckbam is still prepared in wood-fired ovens, which give the crust a distinctive aroma. "
Verheiratete,"Hailing from Saarland, verheiratete is a combination of boiled potatoes, flour-based dumplings, and a creamy bacon sauce. This simple German dish is known by the names of verheiratete and geheirate (also geheiratete or geheirade), both with the same meaning of married, the married ones, or a married couple. The name refers to the act of joining or marrying separate ingredients together into one meal, just like when two people are united together in marriage. In Saarland, this dish used to be a part of the poor people’s diet due to the simple, everyday ingredients of which it consists. Over the years, the dish evolved into a comfort food beloved by everyone."
Kartoffelschmarrn,"Kartoffelschmarrn is a traditional and Bavarian dish, resembling a savory potato pancake or scramble. It is made by grating raw potatoes and mixing them with eggs, flour, and seasonings such as salt and nutmeg. The mixture is then fried in a pan until golden brown, often with onions and sometimes with bacon or ham for added flavor. The texture is crispy on the outside while remaining soft and tender on the inside. Kartoffelschmarrn is typically served as a hearty main dish, often accompanied by a fresh salad or sour cream."
Rettichsalat,"Rettichsalat is a traditional salad originating from Bavaria. This Bavarian classic is made with a combination of white radish, chives, white wine vinegar, vegetable oil, salt, and black pepper. The radish is peeled and sliced into thin disks. The vinegar is mixed with salt, pepper, and oil. The radish slices are simply tossed with the dressing and then garnished with chives before serving. Rettichsalat is often served as an accompaniment to meat dishes."
Weckewerk,"Weckewerk is a traditional sausage, particularly popular in Northern Hesse. The main ingredients are pork, bread, and seasonings, which are cooked together into a thick, savory mixture. The dish was historically a way to use up leftover pork and stale bread, making it an economical and resourceful meal. It is typically flavored with spices such as marjoram, onions, pepper, and nutmeg. Weckewerk is usually served hot, often with potatoes or on bread, and is known for its rich, hearty flavor.  "
Saure Kutteln,"Saure Kutteln is a sour tripe stew originating from Baden-Württemberg, a region in southwestern Germany. This dish features tender strips of beef stomach simmered in a tangy vinegar-based sauce, balancing the rich texture of the tripe with a refreshing acidity. The preparation includes slow cooking the tripe after thorough cleaning, then gently simmering it with vinegar, broth, sautéed onions, and aromatic spices such as bay leaves, juniper berries, and peppercorns. Saure Kutteln reflects the culinary traditions of Baden-Württemberg, where resourcefulness and hearty flavors are valued, turning offal into a satisfying and flavorful meal. The history of Saure Kutteln is tied to the rural communities of the region, where cooks made use of all parts of the animal and developed dishes that were both economical and nourishing. This sour tripe stew stands apart from other offal dishes through its distinctive acidic profile, which helps to tenderize the meat and enhance its flavor. Once a common dish in home kitchens, it now finds a place mainly in local taverns and specialty restaurants that preserve the region’s gastronomic heritage. The dish is typically served hot, accompanied by hearty sides like crusty bread or boiled potatoes that absorb the flavorful sauce. "
Puddingbrezel,"Puddingbrezel is a sweet pastry originating in Germany, where it is commonly found in bakeries across southern and western regions. The name translates to “pudding pretzel,” reflecting both its distinctive shape and the creamy filling that defines it. The dough is usually a rich, buttery yeast dough similar to Danish pastry, prepared by layering the dough with fat to create a light, flaky texture. Once the dough has been rolled out and folded, it is cut into strips and twisted into a figure-eight or pretzel shape. Before baking, the pastry is filled with a smooth vanilla custard that sits in the central loops of the form. During baking, the custard sets into a firm, glossy layer while the pastry develops a golden brown surface. After cooling, the Puddingbrezel is often finished with a thin sugar glaze to enhance sweetness and give it a slight sheen. The combination of buttery dough and soft vanilla filling makes it popular as a midmorning snack or an accompaniment to coffee. Unlike some filled pastries, the custard in a Puddingbrezel is applied raw and baked along with the dough, so it becomes integrated into the structure rather than added afterward. Puddingbrezel can be found in many German bakeries year-round, and although recipes are similar, small variations exist in the proportions of butter, sugar, and custard thickness. Some bakers use a richer pastry base while others prefer a lighter version with more pronounced layers. The shape is always recognizable, with the custard filling arranged symmetrically in the loops. Because the dough is laminated, it requires careful handling and enough resting time to develop the right texture without becoming tough."
Schusterjunge,"Schusterjunge (lit. cobbler's apprentice) is a traditional bread roll originating from Berlin. The bread rolls are usually made with a combination of rye flour, wheat flour, yeast or baking powder, salt, caraway seeds, and beer. The flours are mixed with yeast or baking powder, salt, and caraway seeds. Beer is added gradually, and the smooth dough is then shaped into small round rolls. The dough is dipped in caraway seeds and coarse salt before the rye rolls are baked until brown."
Backerbsensuppe,"Backerbsensuppe is an Austrian and southern German soup made with small, round, fried dough pieces known as Backerbsen, served floating in a clear broth. The name translates literally to “baked peas,” although the dumplings are not made from peas but from a batter of flour, eggs, milk, and seasonings that is fried until golden and crisp. The dish is particularly associated with Austria and Bavaria, where soups play a central role in meals, often served as a first course before heartier dishes. Its origins are linked to the broader Central European habit of enriching simple broths with dumplings or small additions that turned them into more filling fare. Backerbsen were developed as a way to provide texture and substance without requiring fresh bread at the table, as they could be fried in advance and stored for long periods. Over time, they became a recognizable accompaniment in their own right, sold in bakeries and shops as well as prepared at home. Preparation begins with making a thick batter of flour, eggs, and milk, sometimes with a pinch of baking powder to give the dough a slight lift. The batter is dropped in tiny portions into hot fat and fried until small golden balls form, which are then drained and cooled. When added to a bowl of clear beef or vegetable broth, the Backerbsen soften slightly on the outside while keeping a bit of crunch within. The contrast between the light broth and the fried dumplings defines the appeal of the dish. Backerbsen are often prepared in large batches and kept in airtight containers, making them a convenient pantry item to transform a simple broth into a recognizable soup. This storage-friendly quality gave them a place in rural households where cooking was done less frequently in bulk, and they are still sold packaged in Austrian and German supermarkets today. Backerbsensuppe is eaten in homes and restaurants across Austria and Bavaria, usually served as a starter at family meals, in Gasthäuser, and at festive gatherings."
Saure Nieren,"Saure Nieren is a German dish made using pig's kidneys simmered in a tangy, vinegar-based sauce. This preparation highlights the distinct flavors of kidneys, balancing their rich, earthy taste with the sharpness of vinegar and the sweetness of onions. The kidneys are carefully cleaned and simmered until tender, then sliced and cooked in a sauce composed of vinegar, broth, sautéed onions, and a blend of spices including bay leaves and peppercorns. A subtle hint of sugar is often added to mellow the acidity of the vinegar and to harmonize the overall taste. This slow cooking process allows the flavors to meld, softening the intensity of the kidneys while maintaining the characteristic tang of the dish. Saure Nieren is served warm, traditionally accompanied by sides such as boiled potatoes, crusty rye bread, or dumplings, which help absorb the flavorful sauce. It remains a popular dish in German households and specialty restaurants, especially in areas with a strong appreciation for offal-based cuisine. "
Auszogne,"Kiachl is a traditional pastry from the Tyrol region in Austria. It's a type of fried yeast dough pastry often enjoyed during the Christmas season and at local festivals. When making kiachl, a yeasted dough is left to rise, then shaped into a round, flat form with a depression in the middle. The dough is then deep-fried in hot lard or oil until golden brown. After frying, kiachl can be served as a sweet and savory, depending on the topping. Sweet kiachl is dusted with powdered sugar and often served with a side of cranberry jam or other fruit compote. Savory kiachl is typically served with sauerkraut, making for a hearty, satisfying dish. "
Kartoffelkaese,"Kartoffelkäse is a creamy potato-based spread that originates from the southern regions of Germany, particularly Bavaria and Upper Austria (where it's called Erdäpfelkäse), where it is often served in beer gardens and at countryside gatherings. Despite its name, which translates to ""potato cheese,"" the dish contains no actual cheese; instead, it refers to the smooth, spreadable texture that resembles soft cheese. Made primarily from boiled and mashed potatoes mixed with sour cream or quark, finely chopped onions, chives, and mild seasonings, kartoffelkäse is a savory, tangy, and lightly fluffy accompaniment commonly enjoyed with rye bread, pretzels, or as a cold side to meats and sausages. Its origins lie in agrarian communities where potatoes were a dietary staple and dairy products like quark were readily available from local farms. The preparation is uncomplicated, requiring only the gentle blending of starchy potatoes with the creamy base, then chilled slightly to allow the flavors to meld. Each household might have its own version, varying the proportions of cream, the type of onion used, or the presence of additions like caraway seeds or fresh herbs. Served cold or at room temperature, kartoffelkäse is a common sight at buffets, seasonal festivals, and wine tastings across southern Germany and Austria. It pairs especially well with sourdough or Bauernbrot and often accompanies a glass of local beer or white wine. "
Bauernbratwurst,"Bauernbratwurst, which translates to ""farmer’s bratwurst"", is a traditional sausage known for its rustic and hearty flavor. It is typically made from coarsely ground pork, though some variations may include a mixture of pork and beef. The meat is seasoned with a blend of spices such as garlic, pepper, marjoram, paprika and sometimes onion or nutmeg. What distinguishes Bauernbratwurst from other bratwurst varieties is its rustic, country-style preparation. The sausage has a coarser texture than finer bratwursts and is often smoked, which gives it a deeper, richer flavor. This sausage is often associated with rural areas, where it has historically been made by farmers using traditional sausage-making methods. Bauernbratwurst is typically cooked by grilling or pan-frying, which helps develop its savory flavor and crispy exterior. It is usually served with classic German accompaniments such as sauerkraut, potatoes, mustard, or simply with bread."
Coburger Bratwurst,"Coburger Bratwurst is a distinctive type of German sausage originating from the town of Coburg in northern Bavaria. Known for its pale color and fine texture, this sausage is traditionally made from coarsely ground pork and veal combined with a blend of spices including salt, pepper, marjoram and nutmeg. Its unique preparation and seasoning result in a mild but flavorful sausage that stands apart from other regional bratwurst varieties. Coburger Bratwurst is commonly grilled over pinecones or hardwood, which imparts a subtle smoky aroma that complements its delicate taste and adds to its culinary appeal. The history of Coburger Bratwurst dates back several centuries, with the sausage gaining official recognition in the early 15th century. Its recipe has been carefully preserved and guarded by local butchers in Coburg, contributing to its reputation as a specialty of the region. The connection between the sausage and the town is strong, with the sausage serving as a symbol of local pride and craftsmanship. Over time, Coburger Bratwurst has become a popular delicacy not only in Coburg but throughout Bavaria and Germany, enjoyed by those who appreciate the balance of simplicity and flavor in regional sausages. Preparation of Coburger Bratwurst involves selecting high-quality veal and pork shoulder and backfat, grinding the meat coarsely, and mixing it with the signature spice blend. The mixture is then stuffed into natural pork casings and shaped into sausages approximately 15 to 20 centimeters in length. The sausages are traditionally cooked on a grill over pinecones or hardwood, which enhances the flavor with subtle smokiness while ensuring a juicy interior and a lightly crisped exterior. The careful balance of seasoning and the distinctive grilling method contribute to the sausage’s characteristic mild yet aromatic profile. Coburger Bratwurst is typically served hot, often accompanied by mustard, freshly baked bread rolls, and a side of sauerkraut or potato salad. It is a common feature at local festivals, markets, and beer gardens where it is enjoyed as a snack or meal. "
Hoppelpoppel,"Hoppelpoppel is a traditional dish originating from Berlin. The dish is usually made with a combination of boiled potatoes, butter or olive oil, onions, bell peppers, eggs, milk, parsley, and pork loin or salami. This popular way to use leftovers is made in a skillet – the potatoes, vegetables, and meat are fried in butter or olive oil, and the eggs, parsley, and milk are poured over the mixture until the eggs are set but still moist. The dish is served on a large platter, usually garnished with tomatoes and pickles. Hoppelpoppel also often appears on Midwestern diner menus in the United States."
Sauerampfersuppe,"Sauerampfersuppe is a traditional soup originating from the southern parts of the country. The soup is usually made with a combination of sorrel, shallots, butter, flour, chicken stock, heavy cream, egg yolks, salt, and black pepper. The shallots and sorrel are sautéed in butter until one is translucent and the other one slightly wilted. Flour is whisked in and cooked until beige, and it's then mixed with the stock. The mixture is simmered for a few minutes, the soup is puréed, and then reheated and removed from the heat. A mixture of egg yolks and heavy cream is stirred into the soup. Sauerampfersuppe is seasoned with salt and pepper and served piping hot."
Potthucke,"Potthucke is a traditional potato cake originating from the Sauerland region in Westphalia. It's made with a combination of potatoes, eggs, milk, sour cream, butter, salt, and pepper. Half of the potatoes are boiled and grated, and the remaining half is boiled and mashed. The two are mixed together with sour cream, milk, eggs, seasonings, and the white starch from the cooking liquid. The batter is poured into a greased loaf pan, dotted with butter, and baked until browned and crisp. Once cooled, the loaf is typically cut into thin slices and sautéed in butter on both sides before it's served hot. Potthucke is traditionally washed down with schnapps or beer. This savory cake has many variations, so it can also contain ingredients such as bacon and onions."
